create table gcs_part_range_tb_1(c1 int not null primary key auto_increment,
c2 varchar(128) not null default 'aa',
c3 char(24),
c4 int not null default 1,
c5 blob,
c6 timestamp,
key idx(c2,c3,c4)) engine=innodb row_format=gcs charset=utf8 partition by range(c1) 
(partition p1 values less than (100),
partition p2 values less than (200),
partition p3 values less than (1000),
partition p4 values less than MAXVALUE);
show create table gcs_part_range_tb_1;
Table	Create Table
gcs_part_range_tb_1	CREATE TABLE `gcs_part_range_tb_1` (
  `c1` int(11) NOT NULL AUTO_INCREMENT,
  `c2` varchar(128) NOT NULL DEFAULT 'aa',
  `c3` char(24) DEFAULT NULL,
  `c4` int(11) NOT NULL DEFAULT '1',
  `c5` blob,
  `c6` timestamp NOT NULL DEFAULT CURRENT_TIMESTAMP ON UPDATE CURRENT_TIMESTAMP,
  PRIMARY KEY (`c1`),
  KEY `idx` (`c2`,`c3`,`c4`)
) ENGINE=InnoDB DEFAULT CHARSET=utf8 ROW_FORMAT=GCS
/*!50100 PARTITION BY RANGE (c1)
(PARTITION p1 VALUES LESS THAN (100) ENGINE = InnoDB,
 PARTITION p2 VALUES LESS THAN (200) ENGINE = InnoDB,
 PARTITION p3 VALUES LESS THAN (1000) ENGINE = InnoDB,
 PARTITION p4 VALUES LESS THAN MAXVALUE ENGINE = InnoDB) */
show table status like 'gcs_part_range_tb_1';
Name	Engine	Version	Row_format	Rows	Avg_row_length	Data_length	Max_data_length	Index_length	Data_free	Auto_increment	Create_time	Update_time	Check_time	Collation	Checksum	Create_options	Comment
gcs_part_range_tb_1	InnoDB	10	Gcs	4	16384	65536	0	65536	41943040	1	NULL	NULL	NULL	utf8_general_ci	NULL	row_format=GCS partitioned	
create table gcs_part_list_tb_1(c1 int not null primary key auto_increment,
c2 varchar(128) not null default 'aa',
c3 char(24),
c4 int not null default 1,
c5 blob,
c6 timestamp,
key idx(c2,c3,c4)) engine=innodb row_format=gcs charset=utf8 partition by list(c1) 
(partition p1 values in (100),
partition p2 values in (200),
partition p3 values in (1000),
partition p4 values in (1,2,3,4,5));
show create table gcs_part_list_tb_1;
Table	Create Table
gcs_part_list_tb_1	CREATE TABLE `gcs_part_list_tb_1` (
  `c1` int(11) NOT NULL AUTO_INCREMENT,
  `c2` varchar(128) NOT NULL DEFAULT 'aa',
  `c3` char(24) DEFAULT NULL,
  `c4` int(11) NOT NULL DEFAULT '1',
  `c5` blob,
  `c6` timestamp NOT NULL DEFAULT CURRENT_TIMESTAMP ON UPDATE CURRENT_TIMESTAMP,
  PRIMARY KEY (`c1`),
  KEY `idx` (`c2`,`c3`,`c4`)
) ENGINE=InnoDB DEFAULT CHARSET=utf8 ROW_FORMAT=GCS
/*!50100 PARTITION BY LIST (c1)
(PARTITION p1 VALUES IN (100) ENGINE = InnoDB,
 PARTITION p2 VALUES IN (200) ENGINE = InnoDB,
 PARTITION p3 VALUES IN (1000) ENGINE = InnoDB,
 PARTITION p4 VALUES IN (1,2,3,4,5) ENGINE = InnoDB) */
show table status like 'gcs_part_list_tb_1';
Name	Engine	Version	Row_format	Rows	Avg_row_length	Data_length	Max_data_length	Index_length	Data_free	Auto_increment	Create_time	Update_time	Check_time	Collation	Checksum	Create_options	Comment
gcs_part_list_tb_1	InnoDB	10	Gcs	4	16384	65536	0	65536	37748736	1	NULL	NULL	NULL	utf8_general_ci	NULL	row_format=GCS partitioned	
create table normal_part_range_tb_2(c1 int not null primary key auto_increment,
c2 varchar(128) not null default 'aa',
c3 char(24),
c4 int not null default 1,
c5 blob,
c6 timestamp,
key idx(c2,c3,c4)) engine=innodb row_format=compact charset=latin1 partition by range(c1) 
(partition p1 values less than (100),
partition p2 values less than (200),
partition p3 values less than (1000),
partition p4 values less than MAXVALUE);
show create table normal_part_range_tb_2;
Table	Create Table
normal_part_range_tb_2	CREATE TABLE `normal_part_range_tb_2` (
  `c1` int(11) NOT NULL AUTO_INCREMENT,
  `c2` varchar(128) NOT NULL DEFAULT 'aa',
  `c3` char(24) DEFAULT NULL,
  `c4` int(11) NOT NULL DEFAULT '1',
  `c5` blob,
  `c6` timestamp NOT NULL DEFAULT CURRENT_TIMESTAMP ON UPDATE CURRENT_TIMESTAMP,
  PRIMARY KEY (`c1`),
  KEY `idx` (`c2`,`c3`,`c4`)
) ENGINE=InnoDB DEFAULT CHARSET=latin1 ROW_FORMAT=COMPACT
/*!50100 PARTITION BY RANGE (c1)
(PARTITION p1 VALUES LESS THAN (100) ENGINE = InnoDB,
 PARTITION p2 VALUES LESS THAN (200) ENGINE = InnoDB,
 PARTITION p3 VALUES LESS THAN (1000) ENGINE = InnoDB,
 PARTITION p4 VALUES LESS THAN MAXVALUE ENGINE = InnoDB) */
show table status like 'normal_part_range_tb_2';
Name	Engine	Version	Row_format	Rows	Avg_row_length	Data_length	Max_data_length	Index_length	Data_free	Auto_increment	Create_time	Update_time	Check_time	Collation	Checksum	Create_options	Comment
normal_part_range_tb_2	InnoDB	10	Compact	4	16384	65536	0	65536	37748736	1	NULL	NULL	NULL	latin1_swedish_ci	NULL	row_format=COMPACT partitioned	
create table gcs_part_list_tb_2(c1 int not null primary key auto_increment,
c2 varchar(128) not null default 'aa',
c3 char(24),
c4 int not null default 1,
c5 blob,
c6 timestamp,
key idx(c2,c3,c4)) engine=innodb row_format=compact charset=utf8 partition by list(c1) 
(partition p1 values in (100),
partition p2 values in (200),
partition p3 values in (1000),
partition p4 values in (1,2,3,4,5));
show create table gcs_part_list_tb_2;
Table	Create Table
gcs_part_list_tb_2	CREATE TABLE `gcs_part_list_tb_2` (
  `c1` int(11) NOT NULL AUTO_INCREMENT,
  `c2` varchar(128) NOT NULL DEFAULT 'aa',
  `c3` char(24) DEFAULT NULL,
  `c4` int(11) NOT NULL DEFAULT '1',
  `c5` blob,
  `c6` timestamp NOT NULL DEFAULT CURRENT_TIMESTAMP ON UPDATE CURRENT_TIMESTAMP,
  PRIMARY KEY (`c1`),
  KEY `idx` (`c2`,`c3`,`c4`)
) ENGINE=InnoDB DEFAULT CHARSET=utf8 ROW_FORMAT=COMPACT
/*!50100 PARTITION BY LIST (c1)
(PARTITION p1 VALUES IN (100) ENGINE = InnoDB,
 PARTITION p2 VALUES IN (200) ENGINE = InnoDB,
 PARTITION p3 VALUES IN (1000) ENGINE = InnoDB,
 PARTITION p4 VALUES IN (1,2,3,4,5) ENGINE = InnoDB) */
show table status like 'gcs_part_list_tb_2';
Name	Engine	Version	Row_format	Rows	Avg_row_length	Data_length	Max_data_length	Index_length	Data_free	Auto_increment	Create_time	Update_time	Check_time	Collation	Checksum	Create_options	Comment
gcs_part_list_tb_2	InnoDB	10	Compact	4	16384	65536	0	65536	37748736	1	NULL	NULL	NULL	utf8_general_ci	NULL	row_format=COMPACT partitioned	
create table gcs_part_many_column(
c_1 int,
c_2 int,
c_3 int,
c_4 int,
c_5 int,
c_6 int,
c_7 int,
c_8 int,
c_9 int,
c_10 int,
c_11 int,
c_12 int,
c_13 int,
c_14 int,
c_15 int,
c_16 int,
c_17 int,
c_18 int,
c_19 int,
c_20 int,
c_21 int,
c_22 int,
c_23 int,
c_24 int,
c_25 int,
c_26 int,
c_27 int,
c_28 int,
c_29 int,
c_30 int,
c_31 int,
c_32 int,
c_33 int,
c_34 int,
c_35 int,
c_36 int,
c_37 int,
c_38 int,
c_39 int,
c_40 int,
c_41 int,
c_42 int,
c_43 int,
c_44 int,
c_45 int,
c_46 int,
c_47 int,
c_48 int,
c_49 int,
c_50 int,
c_51 int,
c_52 int,
c_53 int,
c_54 int,
c_55 int,
c_56 int,
c_57 int,
c_58 int,
c_59 int,
c_60 int,
c_61 int,
c_62 int,
c_63 int,
c_64 int,
c_65 int,
c_66 int,
c_67 int,
c_68 int,
c_69 int,
c_70 int,
c_71 int,
c_72 int,
c_73 int,
c_74 int,
c_75 int,
c_76 int,
c_77 int,
c_78 int,
c_79 int,
c_80 int,
c_81 int,
c_82 int,
c_83 int,
c_84 int,
c_85 int,
c_86 int,
c_87 int,
c_88 int,
c_89 int,
c_90 int,
c_91 int,
c_92 int,
c_93 int,
c_94 int,
c_95 int,
c_96 int,
c_97 int,
c_98 int,
c_99 int,
c_100 int,
c_101 int,
c_102 int,
c_103 int,
c_104 int,
c_105 int,
c_106 int,
c_107 int,
c_108 int,
c_109 int,
c_110 int,
c_111 int,
c_112 int,
c_113 int,
c_114 int,
c_115 int,
c_116 int,
c_117 int,
c_118 int,
c_119 int,
c_120 int,
c_121 int,
c_122 int,
c_123 int,
c_124 int,
c_125 int,
c_126 int,
c_127 int) row_format=gcs engine=innodb partition by range(c_1) 
(partition p1 values less than (100),
partition p2 values less than (200),
partition p3 values less than (1000),
partition p4 values less than MAXVALUE);
show table status like 'gcs_part_many_column';
Name	Engine	Version	Row_format	Rows	Avg_row_length	Data_length	Max_data_length	Index_length	Data_free	Auto_increment	Create_time	Update_time	Check_time	Collation	Checksum	Create_options	Comment
gcs_part_many_column	InnoDB	10	Gcs	4	16384	65536	0	0	37748736	NULL	NULL	NULL	NULL	latin1_swedish_ci	NULL	row_format=GCS partitioned	
alter table gcs_part_many_column row_format=compact;
show create table gcs_part_many_column;
Table	Create Table
gcs_part_many_column	CREATE TABLE `gcs_part_many_column` (
  `c_1` int(11) DEFAULT NULL,
  `c_2` int(11) DEFAULT NULL,
  `c_3` int(11) DEFAULT NULL,
  `c_4` int(11) DEFAULT NULL,
  `c_5` int(11) DEFAULT NULL,
  `c_6` int(11) DEFAULT NULL,
  `c_7` int(11) DEFAULT NULL,
  `c_8` int(11) DEFAULT NULL,
  `c_9` int(11) DEFAULT NULL,
  `c_10` int(11) DEFAULT NULL,
  `c_11` int(11) DEFAULT NULL,
  `c_12` int(11) DEFAULT NULL,
  `c_13` int(11) DEFAULT NULL,
  `c_14` int(11) DEFAULT NULL,
  `c_15` int(11) DEFAULT NULL,
  `c_16` int(11) DEFAULT NULL,
  `c_17` int(11) DEFAULT NULL,
  `c_18` int(11) DEFAULT NULL,
  `c_19` int(11) DEFAULT NULL,
  `c_20` int(11) DEFAULT NULL,
  `c_21` int(11) DEFAULT NULL,
  `c_22` int(11) DEFAULT NULL,
  `c_23` int(11) DEFAULT NULL,
  `c_24` int(11) DEFAULT NULL,
  `c_25` int(11) DEFAULT NULL,
  `c_26` int(11) DEFAULT NULL,
  `c_27` int(11) DEFAULT NULL,
  `c_28` int(11) DEFAULT NULL,
  `c_29` int(11) DEFAULT NULL,
  `c_30` int(11) DEFAULT NULL,
  `c_31` int(11) DEFAULT NULL,
  `c_32` int(11) DEFAULT NULL,
  `c_33` int(11) DEFAULT NULL,
  `c_34` int(11) DEFAULT NULL,
  `c_35` int(11) DEFAULT NULL,
  `c_36` int(11) DEFAULT NULL,
  `c_37` int(11) DEFAULT NULL,
  `c_38` int(11) DEFAULT NULL,
  `c_39` int(11) DEFAULT NULL,
  `c_40` int(11) DEFAULT NULL,
  `c_41` int(11) DEFAULT NULL,
  `c_42` int(11) DEFAULT NULL,
  `c_43` int(11) DEFAULT NULL,
  `c_44` int(11) DEFAULT NULL,
  `c_45` int(11) DEFAULT NULL,
  `c_46` int(11) DEFAULT NULL,
  `c_47` int(11) DEFAULT NULL,
  `c_48` int(11) DEFAULT NULL,
  `c_49` int(11) DEFAULT NULL,
  `c_50` int(11) DEFAULT NULL,
  `c_51` int(11) DEFAULT NULL,
  `c_52` int(11) DEFAULT NULL,
  `c_53` int(11) DEFAULT NULL,
  `c_54` int(11) DEFAULT NULL,
  `c_55` int(11) DEFAULT NULL,
  `c_56` int(11) DEFAULT NULL,
  `c_57` int(11) DEFAULT NULL,
  `c_58` int(11) DEFAULT NULL,
  `c_59` int(11) DEFAULT NULL,
  `c_60` int(11) DEFAULT NULL,
  `c_61` int(11) DEFAULT NULL,
  `c_62` int(11) DEFAULT NULL,
  `c_63` int(11) DEFAULT NULL,
  `c_64` int(11) DEFAULT NULL,
  `c_65` int(11) DEFAULT NULL,
  `c_66` int(11) DEFAULT NULL,
  `c_67` int(11) DEFAULT NULL,
  `c_68` int(11) DEFAULT NULL,
  `c_69` int(11) DEFAULT NULL,
  `c_70` int(11) DEFAULT NULL,
  `c_71` int(11) DEFAULT NULL,
  `c_72` int(11) DEFAULT NULL,
  `c_73` int(11) DEFAULT NULL,
  `c_74` int(11) DEFAULT NULL,
  `c_75` int(11) DEFAULT NULL,
  `c_76` int(11) DEFAULT NULL,
  `c_77` int(11) DEFAULT NULL,
  `c_78` int(11) DEFAULT NULL,
  `c_79` int(11) DEFAULT NULL,
  `c_80` int(11) DEFAULT NULL,
  `c_81` int(11) DEFAULT NULL,
  `c_82` int(11) DEFAULT NULL,
  `c_83` int(11) DEFAULT NULL,
  `c_84` int(11) DEFAULT NULL,
  `c_85` int(11) DEFAULT NULL,
  `c_86` int(11) DEFAULT NULL,
  `c_87` int(11) DEFAULT NULL,
  `c_88` int(11) DEFAULT NULL,
  `c_89` int(11) DEFAULT NULL,
  `c_90` int(11) DEFAULT NULL,
  `c_91` int(11) DEFAULT NULL,
  `c_92` int(11) DEFAULT NULL,
  `c_93` int(11) DEFAULT NULL,
  `c_94` int(11) DEFAULT NULL,
  `c_95` int(11) DEFAULT NULL,
  `c_96` int(11) DEFAULT NULL,
  `c_97` int(11) DEFAULT NULL,
  `c_98` int(11) DEFAULT NULL,
  `c_99` int(11) DEFAULT NULL,
  `c_100` int(11) DEFAULT NULL,
  `c_101` int(11) DEFAULT NULL,
  `c_102` int(11) DEFAULT NULL,
  `c_103` int(11) DEFAULT NULL,
  `c_104` int(11) DEFAULT NULL,
  `c_105` int(11) DEFAULT NULL,
  `c_106` int(11) DEFAULT NULL,
  `c_107` int(11) DEFAULT NULL,
  `c_108` int(11) DEFAULT NULL,
  `c_109` int(11) DEFAULT NULL,
  `c_110` int(11) DEFAULT NULL,
  `c_111` int(11) DEFAULT NULL,
  `c_112` int(11) DEFAULT NULL,
  `c_113` int(11) DEFAULT NULL,
  `c_114` int(11) DEFAULT NULL,
  `c_115` int(11) DEFAULT NULL,
  `c_116` int(11) DEFAULT NULL,
  `c_117` int(11) DEFAULT NULL,
  `c_118` int(11) DEFAULT NULL,
  `c_119` int(11) DEFAULT NULL,
  `c_120` int(11) DEFAULT NULL,
  `c_121` int(11) DEFAULT NULL,
  `c_122` int(11) DEFAULT NULL,
  `c_123` int(11) DEFAULT NULL,
  `c_124` int(11) DEFAULT NULL,
  `c_125` int(11) DEFAULT NULL,
  `c_126` int(11) DEFAULT NULL,
  `c_127` int(11) DEFAULT NULL
) ENGINE=InnoDB DEFAULT CHARSET=latin1 ROW_FORMAT=COMPACT
/*!50100 PARTITION BY RANGE (c_1)
(PARTITION p1 VALUES LESS THAN (100) ENGINE = InnoDB,
 PARTITION p2 VALUES LESS THAN (200) ENGINE = InnoDB,
 PARTITION p3 VALUES LESS THAN (1000) ENGINE = InnoDB,
 PARTITION p4 VALUES LESS THAN MAXVALUE ENGINE = InnoDB) */
alter table gcs_part_many_column row_format=gcs;
show create table gcs_part_many_column;
Table	Create Table
gcs_part_many_column	CREATE TABLE `gcs_part_many_column` (
  `c_1` int(11) DEFAULT NULL,
  `c_2` int(11) DEFAULT NULL,
  `c_3` int(11) DEFAULT NULL,
  `c_4` int(11) DEFAULT NULL,
  `c_5` int(11) DEFAULT NULL,
  `c_6` int(11) DEFAULT NULL,
  `c_7` int(11) DEFAULT NULL,
  `c_8` int(11) DEFAULT NULL,
  `c_9` int(11) DEFAULT NULL,
  `c_10` int(11) DEFAULT NULL,
  `c_11` int(11) DEFAULT NULL,
  `c_12` int(11) DEFAULT NULL,
  `c_13` int(11) DEFAULT NULL,
  `c_14` int(11) DEFAULT NULL,
  `c_15` int(11) DEFAULT NULL,
  `c_16` int(11) DEFAULT NULL,
  `c_17` int(11) DEFAULT NULL,
  `c_18` int(11) DEFAULT NULL,
  `c_19` int(11) DEFAULT NULL,
  `c_20` int(11) DEFAULT NULL,
  `c_21` int(11) DEFAULT NULL,
  `c_22` int(11) DEFAULT NULL,
  `c_23` int(11) DEFAULT NULL,
  `c_24` int(11) DEFAULT NULL,
  `c_25` int(11) DEFAULT NULL,
  `c_26` int(11) DEFAULT NULL,
  `c_27` int(11) DEFAULT NULL,
  `c_28` int(11) DEFAULT NULL,
  `c_29` int(11) DEFAULT NULL,
  `c_30` int(11) DEFAULT NULL,
  `c_31` int(11) DEFAULT NULL,
  `c_32` int(11) DEFAULT NULL,
  `c_33` int(11) DEFAULT NULL,
  `c_34` int(11) DEFAULT NULL,
  `c_35` int(11) DEFAULT NULL,
  `c_36` int(11) DEFAULT NULL,
  `c_37` int(11) DEFAULT NULL,
  `c_38` int(11) DEFAULT NULL,
  `c_39` int(11) DEFAULT NULL,
  `c_40` int(11) DEFAULT NULL,
  `c_41` int(11) DEFAULT NULL,
  `c_42` int(11) DEFAULT NULL,
  `c_43` int(11) DEFAULT NULL,
  `c_44` int(11) DEFAULT NULL,
  `c_45` int(11) DEFAULT NULL,
  `c_46` int(11) DEFAULT NULL,
  `c_47` int(11) DEFAULT NULL,
  `c_48` int(11) DEFAULT NULL,
  `c_49` int(11) DEFAULT NULL,
  `c_50` int(11) DEFAULT NULL,
  `c_51` int(11) DEFAULT NULL,
  `c_52` int(11) DEFAULT NULL,
  `c_53` int(11) DEFAULT NULL,
  `c_54` int(11) DEFAULT NULL,
  `c_55` int(11) DEFAULT NULL,
  `c_56` int(11) DEFAULT NULL,
  `c_57` int(11) DEFAULT NULL,
  `c_58` int(11) DEFAULT NULL,
  `c_59` int(11) DEFAULT NULL,
  `c_60` int(11) DEFAULT NULL,
  `c_61` int(11) DEFAULT NULL,
  `c_62` int(11) DEFAULT NULL,
  `c_63` int(11) DEFAULT NULL,
  `c_64` int(11) DEFAULT NULL,
  `c_65` int(11) DEFAULT NULL,
  `c_66` int(11) DEFAULT NULL,
  `c_67` int(11) DEFAULT NULL,
  `c_68` int(11) DEFAULT NULL,
  `c_69` int(11) DEFAULT NULL,
  `c_70` int(11) DEFAULT NULL,
  `c_71` int(11) DEFAULT NULL,
  `c_72` int(11) DEFAULT NULL,
  `c_73` int(11) DEFAULT NULL,
  `c_74` int(11) DEFAULT NULL,
  `c_75` int(11) DEFAULT NULL,
  `c_76` int(11) DEFAULT NULL,
  `c_77` int(11) DEFAULT NULL,
  `c_78` int(11) DEFAULT NULL,
  `c_79` int(11) DEFAULT NULL,
  `c_80` int(11) DEFAULT NULL,
  `c_81` int(11) DEFAULT NULL,
  `c_82` int(11) DEFAULT NULL,
  `c_83` int(11) DEFAULT NULL,
  `c_84` int(11) DEFAULT NULL,
  `c_85` int(11) DEFAULT NULL,
  `c_86` int(11) DEFAULT NULL,
  `c_87` int(11) DEFAULT NULL,
  `c_88` int(11) DEFAULT NULL,
  `c_89` int(11) DEFAULT NULL,
  `c_90` int(11) DEFAULT NULL,
  `c_91` int(11) DEFAULT NULL,
  `c_92` int(11) DEFAULT NULL,
  `c_93` int(11) DEFAULT NULL,
  `c_94` int(11) DEFAULT NULL,
  `c_95` int(11) DEFAULT NULL,
  `c_96` int(11) DEFAULT NULL,
  `c_97` int(11) DEFAULT NULL,
  `c_98` int(11) DEFAULT NULL,
  `c_99` int(11) DEFAULT NULL,
  `c_100` int(11) DEFAULT NULL,
  `c_101` int(11) DEFAULT NULL,
  `c_102` int(11) DEFAULT NULL,
  `c_103` int(11) DEFAULT NULL,
  `c_104` int(11) DEFAULT NULL,
  `c_105` int(11) DEFAULT NULL,
  `c_106` int(11) DEFAULT NULL,
  `c_107` int(11) DEFAULT NULL,
  `c_108` int(11) DEFAULT NULL,
  `c_109` int(11) DEFAULT NULL,
  `c_110` int(11) DEFAULT NULL,
  `c_111` int(11) DEFAULT NULL,
  `c_112` int(11) DEFAULT NULL,
  `c_113` int(11) DEFAULT NULL,
  `c_114` int(11) DEFAULT NULL,
  `c_115` int(11) DEFAULT NULL,
  `c_116` int(11) DEFAULT NULL,
  `c_117` int(11) DEFAULT NULL,
  `c_118` int(11) DEFAULT NULL,
  `c_119` int(11) DEFAULT NULL,
  `c_120` int(11) DEFAULT NULL,
  `c_121` int(11) DEFAULT NULL,
  `c_122` int(11) DEFAULT NULL,
  `c_123` int(11) DEFAULT NULL,
  `c_124` int(11) DEFAULT NULL,
  `c_125` int(11) DEFAULT NULL,
  `c_126` int(11) DEFAULT NULL,
  `c_127` int(11) DEFAULT NULL
) ENGINE=InnoDB DEFAULT CHARSET=latin1 ROW_FORMAT=GCS
/*!50100 PARTITION BY RANGE (c_1)
(PARTITION p1 VALUES LESS THAN (100) ENGINE = InnoDB,
 PARTITION p2 VALUES LESS THAN (200) ENGINE = InnoDB,
 PARTITION p3 VALUES LESS THAN (1000) ENGINE = InnoDB,
 PARTITION p4 VALUES LESS THAN MAXVALUE ENGINE = InnoDB) */
create table compact_par_many_column_normal(
c_1 int,
c_2 int,
c_3 int,
c_4 int,
c_5 int,
c_6 int,
c_7 int,
c_8 int,
c_9 int,
c_10 int,
c_11 int,
c_12 int,
c_13 int,
c_14 int,
c_15 int,
c_16 int,
c_17 int,
c_18 int,
c_19 int,
c_20 int,
c_21 int,
c_22 int,
c_23 int,
c_24 int,
c_25 int,
c_26 int,
c_27 int,
c_28 int,
c_29 int,
c_30 int,
c_31 int,
c_32 int,
c_33 int,
c_34 int,
c_35 int,
c_36 int,
c_37 int,
c_38 int,
c_39 int,
c_40 int,
c_41 int,
c_42 int,
c_43 int,
c_44 int,
c_45 int,
c_46 int,
c_47 int,
c_48 int,
c_49 int,
c_50 int,
c_51 int,
c_52 int,
c_53 int,
c_54 int,
c_55 int,
c_56 int,
c_57 int,
c_58 int,
c_59 int,
c_60 int,
c_61 int,
c_62 int,
c_63 int,
c_64 int,
c_65 int,
c_66 int,
c_67 int,
c_68 int,
c_69 int,
c_70 int,
c_71 int,
c_72 int,
c_73 int,
c_74 int,
c_75 int,
c_76 int,
c_77 int,
c_78 int,
c_79 int,
c_80 int,
c_81 int,
c_82 int,
c_83 int,
c_84 int,
c_85 int,
c_86 int,
c_87 int,
c_88 int,
c_89 int,
c_90 int,
c_91 int,
c_92 int,
c_93 int,
c_94 int,
c_95 int,
c_96 int,
c_97 int,
c_98 int,
c_99 int,
c_100 int,
c_101 int,
c_102 int,
c_103 int,
c_104 int,
c_105 int,
c_106 int,
c_107 int,
c_108 int,
c_109 int,
c_110 int,
c_111 int,
c_112 int,
c_113 int,
c_114 int,
c_115 int,
c_116 int,
c_117 int,
c_118 int,
c_119 int,
c_120 int,
c_121 int,
c_122 int,
c_123 int,
c_124 int,
c_125 int,
c_126 int,
c_127 int) row_format=compact engine=innodb partition by range(c_1) 
(partition p1 values less than (100),
partition p2 values less than (200),
partition p3 values less than (1000),
partition p4 values less than MAXVALUE);
alter table gcs_part_many_column add column( c_128 int,c_129 int,c_130 int);
show table status like 'gcs_part_many_column';
Name	Engine	Version	Row_format	Rows	Avg_row_length	Data_length	Max_data_length	Index_length	Data_free	Auto_increment	Create_time	Update_time	Check_time	Collation	Checksum	Create_options	Comment
gcs_part_many_column	InnoDB	10	GCS	4	16384	65536	0	0	33554432	NULL	NULL	NULL	NULL	latin1_swedish_ci	NULL	row_format=GCS partitioned	
alter table compact_par_many_column_normal add column( c_128 int,c_129 int,c_130 int);
show table status like 'compact_par_many_column_normal';
Name	Engine	Version	Row_format	Rows	Avg_row_length	Data_length	Max_data_length	Index_length	Data_free	Auto_increment	Create_time	Update_time	Check_time	Collation	Checksum	Create_options	Comment
compact_par_many_column_normal	InnoDB	10	Compact	4	16384	65536	0	0	33554432	NULL	NULL	NULL	NULL	latin1_swedish_ci	NULL	row_format=COMPACT partitioned	
select @a:=1;
@a:=1
1
insert into gcs_part_many_column set c_130=@a;
insert into gcs_part_many_column(c_130) select @a:=@a+1 from gcs_part_many_column;
insert into gcs_part_many_column(c_130) select @a:=@a+1 from gcs_part_many_column;
insert into gcs_part_many_column(c_130) select @a:=@a+1 from gcs_part_many_column;
alter table gcs_part_many_column add index idx_1(c_2,c_3,c_5);
insert into gcs_part_many_column(c_130) select @a:=@a+1 from gcs_part_many_column;
insert into gcs_part_many_column(c_130) select @a:=@a+1 from gcs_part_many_column;
insert into gcs_part_many_column(c_130) select @a:=@a+1 from gcs_part_many_column;
insert into gcs_part_many_column(c_130) select @a:=@a+1 from gcs_part_many_column;
alter table gcs_part_many_column add unique index idx_2(c_1,c_2,c_3,c_130);
insert into gcs_part_many_column(c_130) select @a:=@a+1 from gcs_part_many_column;
insert into gcs_part_many_column(c_130) select @a:=@a+1 from gcs_part_many_column;
alter table gcs_part_many_column add column c_1000 int not null default '0';
select * from gcs_part_many_column where c_130 = 2;
c_1	c_2	c_3	c_4	c_5	c_6	c_7	c_8	c_9	c_10	c_11	c_12	c_13	c_14	c_15	c_16	c_17	c_18	c_19	c_20	c_21	c_22	c_23	c_24	c_25	c_26	c_27	c_28	c_29	c_30	c_31	c_32	c_33	c_34	c_35	c_36	c_37	c_38	c_39	c_40	c_41	c_42	c_43	c_44	c_45	c_46	c_47	c_48	c_49	c_50	c_51	c_52	c_53	c_54	c_55	c_56	c_57	c_58	c_59	c_60	c_61	c_62	c_63	c_64	c_65	c_66	c_67	c_68	c_69	c_70	c_71	c_72	c_73	c_74	c_75	c_76	c_77	c_78	c_79	c_80	c_81	c_82	c_83	c_84	c_85	c_86	c_87	c_88	c_89	c_90	c_91	c_92	c_93	c_94	c_95	c_96	c_97	c_98	c_99	c_100	c_101	c_102	c_103	c_104	c_105	c_106	c_107	c_108	c_109	c_110	c_111	c_112	c_113	c_114	c_115	c_116	c_117	c_118	c_119	c_120	c_121	c_122	c_123	c_124	c_125	c_126	c_127	c_128	c_129	c_130	c_1000
NULL	NULL	NULL	NULL	NULL	NULL	NULL	NULL	NULL	NULL	NULL	NULL	NULL	NULL	NULL	NULL	NULL	NULL	NULL	NULL	NULL	NULL	NULL	NULL	NULL	NULL	NULL	NULL	NULL	NULL	NULL	NULL	NULL	NULL	NULL	NULL	NULL	NULL	NULL	NULL	NULL	NULL	NULL	NULL	NULL	NULL	NULL	NULL	NULL	NULL	NULL	NULL	NULL	NULL	NULL	NULL	NULL	NULL	NULL	NULL	NULL	NULL	NULL	NULL	NULL	NULL	NULL	NULL	NULL	NULL	NULL	NULL	NULL	NULL	NULL	NULL	NULL	NULL	NULL	NULL	NULL	NULL	NULL	NULL	NULL	NULL	NULL	NULL	NULL	NULL	NULL	NULL	NULL	NULL	NULL	NULL	NULL	NULL	NULL	NULL	NULL	NULL	NULL	NULL	NULL	NULL	NULL	NULL	NULL	NULL	NULL	NULL	NULL	NULL	NULL	NULL	NULL	NULL	NULL	NULL	NULL	NULL	NULL	NULL	NULL	NULL	NULL	NULL	NULL	2	0
select count(*) from gcs_part_many_column;
count(*)
512
alter table gcs_part_many_column drop index idx_1;
alter table gcs_part_many_column add index idx_1(c_2,c_3,c_5);
show create table gcs_part_many_column;
Table	Create Table
gcs_part_many_column	CREATE TABLE `gcs_part_many_column` (
  `c_1` int(11) DEFAULT NULL,
  `c_2` int(11) DEFAULT NULL,
  `c_3` int(11) DEFAULT NULL,
  `c_4` int(11) DEFAULT NULL,
  `c_5` int(11) DEFAULT NULL,
  `c_6` int(11) DEFAULT NULL,
  `c_7` int(11) DEFAULT NULL,
  `c_8` int(11) DEFAULT NULL,
  `c_9` int(11) DEFAULT NULL,
  `c_10` int(11) DEFAULT NULL,
  `c_11` int(11) DEFAULT NULL,
  `c_12` int(11) DEFAULT NULL,
  `c_13` int(11) DEFAULT NULL,
  `c_14` int(11) DEFAULT NULL,
  `c_15` int(11) DEFAULT NULL,
  `c_16` int(11) DEFAULT NULL,
  `c_17` int(11) DEFAULT NULL,
  `c_18` int(11) DEFAULT NULL,
  `c_19` int(11) DEFAULT NULL,
  `c_20` int(11) DEFAULT NULL,
  `c_21` int(11) DEFAULT NULL,
  `c_22` int(11) DEFAULT NULL,
  `c_23` int(11) DEFAULT NULL,
  `c_24` int(11) DEFAULT NULL,
  `c_25` int(11) DEFAULT NULL,
  `c_26` int(11) DEFAULT NULL,
  `c_27` int(11) DEFAULT NULL,
  `c_28` int(11) DEFAULT NULL,
  `c_29` int(11) DEFAULT NULL,
  `c_30` int(11) DEFAULT NULL,
  `c_31` int(11) DEFAULT NULL,
  `c_32` int(11) DEFAULT NULL,
  `c_33` int(11) DEFAULT NULL,
  `c_34` int(11) DEFAULT NULL,
  `c_35` int(11) DEFAULT NULL,
  `c_36` int(11) DEFAULT NULL,
  `c_37` int(11) DEFAULT NULL,
  `c_38` int(11) DEFAULT NULL,
  `c_39` int(11) DEFAULT NULL,
  `c_40` int(11) DEFAULT NULL,
  `c_41` int(11) DEFAULT NULL,
  `c_42` int(11) DEFAULT NULL,
  `c_43` int(11) DEFAULT NULL,
  `c_44` int(11) DEFAULT NULL,
  `c_45` int(11) DEFAULT NULL,
  `c_46` int(11) DEFAULT NULL,
  `c_47` int(11) DEFAULT NULL,
  `c_48` int(11) DEFAULT NULL,
  `c_49` int(11) DEFAULT NULL,
  `c_50` int(11) DEFAULT NULL,
  `c_51` int(11) DEFAULT NULL,
  `c_52` int(11) DEFAULT NULL,
  `c_53` int(11) DEFAULT NULL,
  `c_54` int(11) DEFAULT NULL,
  `c_55` int(11) DEFAULT NULL,
  `c_56` int(11) DEFAULT NULL,
  `c_57` int(11) DEFAULT NULL,
  `c_58` int(11) DEFAULT NULL,
  `c_59` int(11) DEFAULT NULL,
  `c_60` int(11) DEFAULT NULL,
  `c_61` int(11) DEFAULT NULL,
  `c_62` int(11) DEFAULT NULL,
  `c_63` int(11) DEFAULT NULL,
  `c_64` int(11) DEFAULT NULL,
  `c_65` int(11) DEFAULT NULL,
  `c_66` int(11) DEFAULT NULL,
  `c_67` int(11) DEFAULT NULL,
  `c_68` int(11) DEFAULT NULL,
  `c_69` int(11) DEFAULT NULL,
  `c_70` int(11) DEFAULT NULL,
  `c_71` int(11) DEFAULT NULL,
  `c_72` int(11) DEFAULT NULL,
  `c_73` int(11) DEFAULT NULL,
  `c_74` int(11) DEFAULT NULL,
  `c_75` int(11) DEFAULT NULL,
  `c_76` int(11) DEFAULT NULL,
  `c_77` int(11) DEFAULT NULL,
  `c_78` int(11) DEFAULT NULL,
  `c_79` int(11) DEFAULT NULL,
  `c_80` int(11) DEFAULT NULL,
  `c_81` int(11) DEFAULT NULL,
  `c_82` int(11) DEFAULT NULL,
  `c_83` int(11) DEFAULT NULL,
  `c_84` int(11) DEFAULT NULL,
  `c_85` int(11) DEFAULT NULL,
  `c_86` int(11) DEFAULT NULL,
  `c_87` int(11) DEFAULT NULL,
  `c_88` int(11) DEFAULT NULL,
  `c_89` int(11) DEFAULT NULL,
  `c_90` int(11) DEFAULT NULL,
  `c_91` int(11) DEFAULT NULL,
  `c_92` int(11) DEFAULT NULL,
  `c_93` int(11) DEFAULT NULL,
  `c_94` int(11) DEFAULT NULL,
  `c_95` int(11) DEFAULT NULL,
  `c_96` int(11) DEFAULT NULL,
  `c_97` int(11) DEFAULT NULL,
  `c_98` int(11) DEFAULT NULL,
  `c_99` int(11) DEFAULT NULL,
  `c_100` int(11) DEFAULT NULL,
  `c_101` int(11) DEFAULT NULL,
  `c_102` int(11) DEFAULT NULL,
  `c_103` int(11) DEFAULT NULL,
  `c_104` int(11) DEFAULT NULL,
  `c_105` int(11) DEFAULT NULL,
  `c_106` int(11) DEFAULT NULL,
  `c_107` int(11) DEFAULT NULL,
  `c_108` int(11) DEFAULT NULL,
  `c_109` int(11) DEFAULT NULL,
  `c_110` int(11) DEFAULT NULL,
  `c_111` int(11) DEFAULT NULL,
  `c_112` int(11) DEFAULT NULL,
  `c_113` int(11) DEFAULT NULL,
  `c_114` int(11) DEFAULT NULL,
  `c_115` int(11) DEFAULT NULL,
  `c_116` int(11) DEFAULT NULL,
  `c_117` int(11) DEFAULT NULL,
  `c_118` int(11) DEFAULT NULL,
  `c_119` int(11) DEFAULT NULL,
  `c_120` int(11) DEFAULT NULL,
  `c_121` int(11) DEFAULT NULL,
  `c_122` int(11) DEFAULT NULL,
  `c_123` int(11) DEFAULT NULL,
  `c_124` int(11) DEFAULT NULL,
  `c_125` int(11) DEFAULT NULL,
  `c_126` int(11) DEFAULT NULL,
  `c_127` int(11) DEFAULT NULL,
  `c_128` int(11) DEFAULT NULL,
  `c_129` int(11) DEFAULT NULL,
  `c_130` int(11) DEFAULT NULL,
  `c_1000` int(11) NOT NULL DEFAULT '0',
  UNIQUE KEY `idx_2` (`c_1`,`c_2`,`c_3`,`c_130`),
  KEY `idx_1` (`c_2`,`c_3`,`c_5`)
) ENGINE=InnoDB DEFAULT CHARSET=latin1 ROW_FORMAT=GCS
/*!50100 PARTITION BY RANGE (c_1)
(PARTITION p1 VALUES LESS THAN (100) ENGINE = InnoDB,
 PARTITION p2 VALUES LESS THAN (200) ENGINE = InnoDB,
 PARTITION p3 VALUES LESS THAN (1000) ENGINE = InnoDB,
 PARTITION p4 VALUES LESS THAN MAXVALUE ENGINE = InnoDB) */
insert into gcs_part_many_column(c_130) select @a:=@a+1 from gcs_part_many_column;
insert into gcs_part_many_column(c_130) select @a:=@a+1 from gcs_part_many_column;
select count(c_130),count(c_1) from gcs_part_many_column ;
count(c_130)	count(c_1)
2048	0
alter table gcs_part_many_column drop column c_2;
alter table gcs_part_many_column drop column c_3;
alter table gcs_part_many_column drop column c_4;
alter table gcs_part_many_column drop column c_5;
alter table gcs_part_many_column drop column c_6;
select count(c_130),count(c_127) from gcs_part_many_column ;
count(c_130)	count(c_127)
2048	0
select count(c_130) from gcs_part_many_column ;
count(c_130)
2048
update gcs_part_many_column set c_130 = c_130+1 ;
alter table gcs_part_many_column add column(c_2 int,c_3 int,c_4 int,c_5 int,c_6 int);
update gcs_part_many_column set c_1 = c_130 ;
select count(c_130),count(c_1) from gcs_part_many_column ;
count(c_130)	count(c_1)
2048	2048
drop table gcs_part_range_tb_1;
drop table normal_part_range_tb_2;
drop table gcs_part_list_tb_1;
drop table gcs_part_list_tb_2;
drop table gcs_part_many_column;
drop table compact_par_many_column_normal;
